,id,title,authors,paper,presentation,best,theme,abstract
15,387,Pilot Evaluation of a UAS Detect-and-Avoid System’s Effectiveness in Remaining Well Clear,"Confesor Santiago ,     Eric Mueller",/seminarContent/seminar11/papers/387-Santiago_0123150803-Final-Paper-7-1-15.pdf,/seminarContent/seminar11/presentations/387-Santiago_0123150803-PresentationPDF-7-1-15.pdf,,Unmanned and remotely piloted aircraft systems,"Unmanned aircraft will equip with a detect-and-avoid (DAA) system that enables them to comply with the requirement to ""see and avoid""  other aircraft, an important layer in the overall set of procedural, strategic and tactical separation methods designed to prevent mid-air  collisions. Regulators will establish minimum operating standards for DAA effectiveness, but different combinations of algorithms, displays  and procedures could be used to meet those standards. The research presented in this paper indicates the effectiveness of the combined  pilot-DAA system as a function of the DAA design requirements and provides data that may be used to model the behavior of pilots when  employing such systems. Two simulations involving 21 professional unmanned aircraft system (UAS) pilots evaluated eight different DAA  system designs in order to assess their ability to maintain the ""well clear"" separation standard, i.e., the state of maintaining a safe distance  from other aircraft that would not normally cause the initiation of a collision avoidance maneuver on either aircraft.   When the traffic  display was integrated with the primary mission map directly in front of the pilot, there were fewer losses of well clear. Greater warning  time provided to the pilot was strongly correlated with success in remaining well clear. Pilots' ability to separate from aircraft with  cooperative and non-cooperative surveillance systems was nearly the same after accounting for the amount of alert time provided in each  encounter, although the limited surveillance volume for the airborne-equipped aircraft meant alerts tended to occur later and therefore  were more difficult to resolve."
16,388,Characteristics of a Well Clear Definition and Alerting Criteria for Encounters between UAS and Manned Aircraft in Class E Airspace,"Marcus Johnson ,     Confesor Santiago,  Eric Mueller",/seminarContent/seminar11/papers/388-Johnson_0123150804-Final-Paper-5-6-15.pdf,/seminarContent/seminar11/presentations/388-Johnson_0123150804-PresentationPDF-6-1-15.pdf,,Unmanned and remotely piloted aircraft systems,"Unmanned aircraft systems will be required to equip with a detect-and-avoid (DAA) system in order to satisfy the federal aviation  regulations to remain well clear of other aircraft. For a DAA system to satisfy the requirement to stay well clear of other airborne traffic, a  quantitative definition of well clear needs to be defined and evaluated. This study investigates the implications of UAS using proposed well  clear definitions as a separation standard for conducting operations in the national airspace system. The first analysis considers three well  clear definitions and presents the relative state conditions of intruder aircraft as they encroach upon the well clear boundary. The second  analysis focuses on the definition of the alerting criteria needed to inform the UAS operator of a potential loss of well clear. All analyses are  conducted in a NAS-wide fast-time simulation environment using UAS aircraft models, proposed UAS missions, and historical air defense  radar data to populate the background traffic operating under visual flight rules. The results presented in this study inform the safety case,  requirements development, and the operational environment for DAA minimum operational performance standards."
17,390,Assessing Resilience of Scheduled Performance-Based Navigation Arrival Operations,"Jae Woo Jung ,     Savita Verma,  Shannon Zelinski,  Thomas Kozon,  Lindsay Sturre",/seminarContent/seminar11/papers/390-Jung_0124150710-Final-Paper-4-23-15.pdf,/seminarContent/seminar11/presentations/390-Jung_0124150710-PresentationPDF-6-4-15.pdf,,Enhanced surveillance and navigation,"This paper assesses the resilience of scheduled Performance-Based Navigation (PBN) arrival operations. Resilience is defined as an ability to return to nominal operations following a schedule perturbation. Results from a Human-in-the-Loop (HITL) experiment that included off-nominal events to perturb the schedule are described. The schedule comes from a precision trajectory-based arrival manager. The experiment collected data regarding the response to perturbed schedules in three conditions, where: 1) a disturbance rejection algorithm made schedule adjustments automatically, 2) a Traffic Management Coordinator (TMC) participant made schedule adjustments manually, or 3) no schedule adjustments were made. Analyses showed that the simulation’s scheduled PBN operations have inherent resilience, recovering from more than half of the perturbed schedules even with no schedule adjustments. Resilience to the same off-nominal events improved with schedule adjustments; an increased proportion of perturbed schedules recovered within the length of operation run, and the average duration of the schedule’s perturbed state decreased. Compared to the manual schedule adjustments condition, a greater number of schedule adjustments occurred for the same off-nominal events in the automated condition. However, perturbed schedules were recovered more frequently and perturbations were less severe in the automated condition. Subjective and objective workload in the manual and the automated schedule adjustment conditions were similar to the no schedule adjustment condition."
18,391,Assessment of a National Airspace System Airborne Rerouting Tool,"Kapil Sheth ,     David McNally,  Patrick Somersall,  Alexander Morando,  Alexis Clymer,  Fu-Tai Shih",/seminarContent/seminar11/papers/391-Sheth_0124150729-Final-Paper-5-6-15.pdf,/seminarContent/seminar11/presentations/391-Sheth_0124150729-PresentationPDF-6-3-15.pdf,,Weather in ATM,"This paper presents the assessment of a National Airspace System airborne rerouting tool.  The tool implements NASA’s Dynamic Weather Routes concept for wind-corrected flying-time savings during convective weather activity.  A description of the system, as applicable to the entire United States airspace is provided, and results are presented demonstrating benefits of such a system from various Centers and airlines’ perspectives.  Three approaches for selection of reroute-return capture fix, which prevent unrealistically large controller clearances are presented.  Results are shown for potential time- and fuel-savings (over 134,000 minutes and 4.2 million lbs. of fuel for over 35,000 proposed reroutes) and sector congestion reduction (over 121 hours in congested sectors) for all 20 Centers.  The data used were for 30 days with highest delays attributable to convective weather from April to October of 2014.  Other results show the evaluation of the maneuver or reroute start point (a parameter representing the amount of coordination time needed), which highlight the need for a controller-pilot data link. A data link would help achieve higher savings.  The results for persistence time, beyond which the time-savings dwindle quickly, help determine the maximum coordination time required for each Center.  Finally, an assessment from a current National Operations Manager at the Air Traffic Control System Command Center of the FAA is documented.  Those suggestions could improve the efficiency of the air transportation system, especially with the expected improvements in the traffic flow management infrastructure.  Currently, one industry partner and one airline are assessing this technology for commercial operational use."
19,395,Fuel and Energy Benchmark Analysis of Continuous Descent Operations,"Hartmut Fricke ,     Christian Seiss,  Robert Herrmann",/seminarContent/seminar11/papers/395-Fricke_0125150225-Final-Paper-5-7-15.pdf,/seminarContent/seminar11/presentations/395-Fricke_0125150225-PresentationPDF-6-11-15.pdf,,Environment and energy efficiency,"In this paper the existing CDO procedures at three relevant German airports are analyzed with respect to both the achievable (maximum specific range) and the effectively achieved fuel savings in comparison to conventionally flown arrivals. To do so, we applied our highly precise flight performance model EJPM [1] to several thousand flown trajectories before and after CDO implementation, the data of which was provided to us as radar track data. A technique was developed to estimate the individual aircraft gross mass for calculating the optimum rate of descent starting from the computed flight-specific Top of Descent (ToD). Furthermore, we considered 3D weather and wind data to determine the CDO trajectory. When locating the trajectories within typical ICAO CDO procedure corridors, we found that the current, generic design criteria does not allow the fuel saving potential of CDO to be utilized. Often because of poor CDO execution from the ground and flight deck, only selected aircraft types managed to maintain the defined boundaries. To gain insight on how much detailed procedure guidance is required, a comprehensive weather and aircraft mass sensitivity analysis is also presented. We found analytic models to improve CDO procedures based on local traffic and meteorological conditions, which should supplement current guidance material."
20,398,"Optimizing Integrated Arrival, Departure and Surface Operations Under Uncertainty","Christabelle  Bosson ,     Min Xue,  Shannon  Zelinski",/seminarContent/seminar11/papers/398_Bosson_0125150433-Final-Paper-4-29-15.pdf,/seminarContent/seminar11/presentations/398-Bosson_0125150433-PresentationPDF-6-10-15.pdf,,Integrated airport/airside operations,"In airports and surrounding terminal airspaces, the integration of arrival, departure and surface scheduling and routing have the potential to improve operations efficiency. Recent research developed a mixed-integer-linear-programming algorithm-based scheduler for integrated arrival and departure operations in the presence of uncertainty. This paper extends previous research to the surface to integrate taxiway and runway operations. The developed algorithm is capable of computing optimal aircraft schedules and routings that reflect the integration of air and ground operations. A preliminary study case is conducted for a set of thirteen aircraft evolving in a model of the Los Angeles International Airport surface and terminal areas. Using historical data, a representative traffic scenario is constructed and probabilistic distributions of pushback delay and arrival gate delay are obtained. To assess the benefits of optimization, a First-Come-First-Served algorithm approach comparison is realized. Evaluation results demonstrate that the optimization can help identify runway sequences and schedules that reduce gate waiting time without increasing average taxi times."
21,400,A Trajectory Optimization Based Analysis of the 3Di Flight Efficiency Metric,Quintain McEnteggart,/seminarContent/seminar11/papers/400-McEnteggart_0125150719-Final-Paper-5-7-15.pdf,/seminarContent/seminar11/presentations/400-McEnteggart_0125150719-PresentationPDF-6-15-15.pdf,,ATM performance measurement and management,"As a means of measuring progress towards fuel and emissions reduction targets, the United Kingdom Air Navigation Service Provider NATS developed the 3Di flight efficiency metric. In principle the 3Di score of a flight is calculated by comparing a flown trajectory to a theoretical fuel/CO2 optimum trajectory. In response to a Eurocontrol review of the metric, the 3Di score has been analysed using a trajectory optimization method based on optimal control. The results suggest that further development of the metric is required to make it sensitive to vertical flight inefficiencies not related to periods of level flight. The results also show that the BADA trajectories used in the 3Di score to define the optimum fuel efficient operation of the aircraft are not optimal fuel efficient trajectories. Additionally, the results show that fuel inefficiencies introduced by flight planning restrictions need to be accounted for in any vertical flight inefficiency metric."
22,401,Enabling Performance-Based Navigation Arrivals: Development and Simulation Testing of the Terminal Sequencing and Spacing System,"John Robinson ,     Jane Thipphavong,  William Johnson",/seminarContent/seminar11/papers/401-Robinson_0126151240-Final-Paper-5-5-15.pdf,/seminarContent/seminar11/presentations/401-Robinson_0126151240-PresentationPDF-6-10-15.pdf,,Trajectory and queue management,"Abstract— NASA has developed an advanced arrival management capability for terminal controllers, known as Terminal Sequencing and Spacing (TSS). TSS increases use of performance-based navigation (PBN) arrival procedures during periods of high traffic demand. It enhances two Federal Aviation Administration operational systems with terminal metering and controller spacing tools. Sixteen high-fidelity human-in-the-loop simulations, involving more than five hundred hours of evaluation time, were conducted to mature TSS from proof-of- concept design to fully functional prototype. These simulations modeled arrival procedures at several U.S. airports, incorporated a broad range of traffic demand profiles and wind conditions, and used controllers with extensive operational experience. Two fundamental metrics are evaluated for these simulations: PBN Success Rate and Inter-Arrival Spacing Error. The PBN Success Rate shows a definitive trend when TSS is used. It increases from 42% for today's operations to 68% for terminal metering only and 92% for terminal metering with controller-managed spacing tools. Meanwhile, the Inter-Arrival Spacing Error improves 25– 35% when TSS is used compared to not used. The TSS technology was transferred to the FAA and, and it is targeted for deployment to several busy airports in the U.S. starting in 2018."
23,403,Evaluation of Pushback Decision-Support Tool Concept for Charlotte Douglas International Airport Ramp Operations,"Miwa Hayashi ,     Ty Hoang,  Yoon Jung,  Waqar Malik,  Hanbong Lee,  Victoria Dulchinos",/seminarContent/seminar11/papers/403_Hayashi_0126150347-Final-Paper-5-5-15.pdf,/seminarContent/seminar11/presentations/403-Hayashi_0126150347-PresentationPDF-6-8-15.pdf,,Integrated airport/airside operations,"This paper proposes a new departure pushback decision-support tool (DST) for airport ramp-tower controllers. It is based on the NASA’s Spot and Runway Departure Advisor (SARDA) Collaborative Decision Making concept, but the gate releases are now controlled by tactical pushback (or gate-hold) advisories rather than strategic pre-assignments of target pushback times to individual departure flights. The proposed ramp DST relies on data exchange with the airport traffic control tower (ATCT) to coordinate pushbacks with the ATCT’s flow-management intentions under the current operational constraints, such as a Traffic Management Initiative (TMI). Airlines are also expected to benefit in reduced taxi delay and fuel burn. With collaboration from American Airlines, the concept was evaluated in a human-in-the-loop simulation experiment with current ramp-tower controllers from the Charlotte Douglas International Airport as participants. The results showed that the tool helped reduce taxi time by one minute per flight and overall departure-flight fuel consumption by 10-12% without reducing runway throughput. Expect Departure Clearance Time conformance was also improved when advisories were provided. These benefits were attained without increasing the ramp controllers’ workload. Additionally, the advisories lowered the tower controllers’ workload level."
24,407,Machine Learning Applied to Airspeed Prediction During Climb,"Richard Alligier ,     David Gianazza,  Nicolas Durand",/seminarContent/seminar11/papers/407-Alligier_0126150750-Final-Paper-6-18-15.pdf,/seminarContent/seminar11/presentations/407-Alligier_0126150750-PresentationPDF-6-23-15.pdf,,Trajectory and queue management,"In this paper, we apply Machine Learning methods to improve the aircraft climb prediction in the context of ground-based applications. Mass and speed intent are key parameters for climb prediction. As they are considered as competitive parameters by many airlines, they are currently not available to ground-based trajectory predictors. Consequently, most predictors today use reference parameters that may be quite different from the actual ones.  In our most recent paper, we have demonstrated that Machine Learning techniques provide a mass estimation significantly more precise than two state-of-the-art mass estimation methods.  In this paper, we apply similar techniques to the speed intent. We first build a set of examples by adjusting CAS/Mach speed profile to each climb trajectory in our database. Then, using the adjusted values (cas,M) in this database, we learn a model able to predict the (cas,M) values of a new trajectory, using its past points as input.  We apply this technique to actual Mode-C radar data and we consider 9 different aircraft types. When compared with the reference speed profiles provided by BADA, the reduction of the speed RMSE ranges from 36 % to 79 %, depending on the aircraft type. Using the predicted mass and speed profile, BADA is used to compute the predicted future trajectory with a 10 minute horizon. When compared with BADA used with the reference parameters, the reduction of the future altitude RMSE ranges from 45 % to 87 %."
25,408,Does ATM Need Centralized Coordination? Autonomous Conflict Resolution  Analysis in a Constrained Speed Environment.,"Nicolas Durand ,     Barnier Nicolas",/seminarContent/seminar11/papers/408-Durand_0126150800-Final-Paper-5-13-15.pdf,/seminarContent/seminar11/presentations/408-Durand_0126150800-PresentationPDF-6-11-15.pdf,,Separation,"The concept of Free-Flight, introduced in the 90s, opened a debate on the efficiency of letting aircraft deal with conflicts without any centralized control. Many models have been proposed for autonomous aircraft solvers but their efficiency is not well-known. In this paper, we experiment powerful algorithm derived from robotics which is able to deal with thousands of robots in very small spaces, and show how its performance plummets when speeds are constrained. We also compare this autonomous algorithm with a centralized approach using evolutionary computation on a complex example to point out their relative performance in a speed constrained environment. This comparison provides scientific arguments for the necessity of centralized air traffic control."
26,411,Validation of the use of GBAS precision approaches for improved runway throughput in poor weather conditions,"Renée Pelchen-Medwed ,     Lendina Smaja,  Anna Wennerberg",/seminarContent/seminar11/papers/411-Pelchen-Medwed_0126150856-Final-Paper-5-29-15.pdf,/seminarContent/seminar11/presentations/411-Pelchen-Medwed_0126150856-PresentationPDF-6-10-15.pdf,,Enhanced surveillance and navigation,"In current low visibility operations at an airport while normally using Instrument Landing System (ILS), extra spacing margins between aircraft have to be provided in order to protect the ILS critical and sensitive areas. This results in a decrease of runway throughput during low visibility conditions. The benefit of the use of Ground-Based Augmentation System (GBAS) instead of ILS in low visibility conditions is that there is no sensitive or critical area that has to be protected. The GBAS Local Object Consideration Areas (LOCA) are also much smaller and usually located outside aircraft movement areas. This leads to an immediate improvement in runway throughput in adverse weather conditions. To validate this anticipated benefit a real-time simulation was conducted in the frame of the SESAR 06.08.05 GBAS operational implementation project. The results of this real-time simulation show that when using GBAS precision approach in LVP operations for segregated runways, the expected runway throughput benefit is materialised without negatively impacting safety and human performance. However, GBAS in LVP operations for mixed mode runway operations might not bring any significant gain in runway throughput since the results indicate that the spacing cannot be reduced as much as expected."
27,414,Risk Analysis Process Tool for Surface Loss of Separation Events,Eric Chang,/seminarContent/seminar11/papers/414-Chang_0126151013-Final-Paper-5-6-15.pdf,/seminarContent/seminar11/presentations/414-Chang_0126151013-PresentationPDF-6-18-15.pdf,,Safety and resilience,The MITRE Corporation’s Center for Advanced Aviation System Development (MITRE/CAASD) made  improvements to the Risk Analysis Process (RAP) Tool scoring methods used in quantifying the risk  level for loss of separation events. These enhancements are designed to evolve the present scoring  methods by using operational data for trend analysis and promoting increased safety through risk  mitigation and management. The new changes aim to simplify the tool’s use and eliminate any potential  biases associated with it. A newly modified RAP Tool has been developed for future evaluation of  events and it closely aligns with the current Federal Aviation Administration (FAA) Safety Management  System (SMS) Risk Matrix. The tool will be used by the FAA to closer examine the risk involved in loss  of separation events in order to better prioritize their mitigations.
28,415,Arrival Scheduling with Shortcut Path Options and Mixed Aircraft Performance,"Shannon Zelinski ,     Jaewoo Jung",/seminarContent/seminar11/papers/415_Zelinski_0126151019-Final-Paper-4-29-15.pdf,/seminarContent/seminar11/presentations/415-Zelinski_0126151019-PresentationPDF-6-18-15.pdf,,Trajectory and queue management,"Previous work introduced the concept of using tactical shortcut options to improve schedule conformance in terminal airspace. When a scheduling point is congested, aircraft are scheduled to longer nominal paths, holding shortcut path options in reserve for tactical use if an aircraft is late, thereby improving the schedule conformance, reducing the required scheduling buffer, and increasing throughput. When the scheduling point is less congested, aircraft may be scheduled to the shorter path with original larger scheduling buffers. Previous work focused on a single generic merge point serving aircraft with uniform arrival precision. This paper extends the previous concept to enhance the performance of time-based arrival management and consider mixed aircraft performance. Aircraft equipped to achieve a high degree of schedule conformance may be scheduled to the shorter path under the same conditions that a less equipped aircraft would be scheduled to the longer path, giving the equipped aircraft an advantage that can be seamlessly integrated into the scheduler. The arrival scheduler with shortcut path options for mixed aircraft performance is applied to a model of first-come-first-served terminal metering at Los Angeles International Airport. Whereas clear system benefits were found for tactical shortcut routing and higher percentages of equipped aircraft, very little advantage could be seen for equipped over unequipped aircraft that could be used to incentivize early equipage."
29,418,A Methodology for Environmental and Energy Assessment of Operational Improvements,"Akshay Belle ,     Dominic McConnachie,  Philippe Bonnefoy",/seminarContent/seminar11/papers/418-Belle_0126151024-Final-Paper-5-7-15.pdf,/seminarContent/seminar11/presentations/418-Belle_0126151024-PresentationPDF-6-18-15.pdf,,Environment and energy efficiency,"NextGen Operational Improvements (OIs) have the highest potential for delivering Environmental and Energy (E&E) benefits in the near term. To foster improved aviation environmental performance, it is important to assess the E&E impacts of NextGen OIs. This paper presents a methodology that uses advanced Aviation Environmental Design Tool (AEDT) based modeling to assess the E&E benefits and tradeoffs of OIs that can potentially improve terminal airspace operations and can affect noise exposure in areas surrounding the airport. The methodology is demonstrated in performing an E&E assessment of the Enhanced Visual Approach (EVA) concept across operational performance (i.e., track distance and time), energy (i.e., fuel savings), emissions and noise. The E&E assessment of EVA is performed at three airports: DEN, BOS and LAX. The results indicate that at 100% equipage (i.e., all aircraft are equipped with EVA-CAVS) and traffic levels of year 2012-2013, EVA-CAVS can result in on average 0.4%, 0.3% and 1.2% improvement annually in terms of operational performance (distance) at DEN, BOS and LAX, respectively. This corresponds to 0.1%, 0.6% and 1.1% reduction in terms of fuel and CO2. Further, the potential reduction in trombones (i.e., stretched flight paths in the downwind leg of final approach) from use of EVA-CAVS can reduce noise exposure as well. The applicability of the methodology to assess the E&E benefits and tradeoffs of other NextGen Operational Improvement Con-Ops is also discussed."
