,id,title,authors,paper,presentation,best,theme,abstract
44,460,A New Method to Validate the Route Extension Metric against Fuel Efficiency,"Esther Calvo ,     José Manuel Cordero,  Luis D’Alto,  Javier López-Leones,  Miguel Vilaplana",/seminarContent/seminar11/papers/460-Calvo_0126150243-Final-Paper-5-7-15.pdf,/seminarContent/seminar11/presentations/460-Calvo_0126150243-PresentationPDF-6-10-15.pdf,,ATM performance measurement and management,"The Flight Efficiency indicator is used to measure how closely the actual trajectory flown by an aircraft approaches the optimum trajectory between the departure and arrival airports. While this is a clear definition from a purely conceptual point of view, is not trivial to determine that so-called optimum trajectory, and thereby its practical calculation.  Considering this perspective, the most common implementation of the Flight Efficiency indicator limits the calculation to the horizontal component of the flight and considers the optimum or reference trajectory as the Great Circle one, introducing the concept of “achieved distance”, what is in fact an apportion of the first. This direct, geodesic route, is considered in this algorithm as the cheapest and thereby most efficient option. In reality, some objections can be put to this methodology, as aircrafts often do not follow this direct route since airlines have to make tradeoffs between several factors, such as meteorological conditions, which may lead to definitions of optimum which differ from Great Circle distance. In particular, many of the considerations on the limits of the Horizontal Flight Efficiency indicator lead to the inclusion of the vertical component in the Flight Efficiency computation, what is in fact is a major improvement in the ATM Performance Monitoring field that hasn’t been deployed yet, and that may lead to confirm if these Great Circle trajectories are really efficient in terms of fuel consumption. This paper explores this innovative direction in a practical way by using real operation data to validate, addressing first the study of the correlation between the Horizontal Efficiency metric proposed by Eurocontrol and the estimated real fuel efficiency, and secondly it proposes a new methodology that constructs an Enhanced Flight Efficiency indicator that captures better this fuel efficiency by considering also the vertical component of flight."
45,466,The current practice of separation delivery at major European airports,"Gerben Van Baren ,     Catherine Chalon-Morgan,  Vincent Treve",/seminarContent/seminar11/papers/466-Van Baren_0126150311-Final-Paper-5-7-15.pdf,/seminarContent/seminar11/presentations/466-Van Baren_0126150311-PresentationPDF-6-25-15.pdf,,Integrated airport/airside operations,"Separation minima are or can become a key bottleneck for the runway throughput at major airports. Therefore, in the context of SESAR Project 6.8.1, EUROCONTROL is investigating concepts for flexible and dynamic use of wake turbulence separations. In order to successfully develop such concepts and optimize the benefits, it is important that current practices and lessons learnt from today’s operations are understood and taken into account. The aim of the study presented in this paper is therefore to baseline the current practices for separation delivery on final approach at major European airports. For this, site visits to European ATC units in combination with analysis of radar data have been conducted. Statistical characteristics on speed, distance and time spacing as observed in today’s operations depending on e.g., airport, headwind, and distance to threshold are determined. Distance spacing close to the threshold as observed in the data satisfies the minimum radar or wake turbulence separation minima with a buffer that is on average in between 0.5 and 1.0 NM and has a standard deviation of about 0.5 NM. The mean compression of distance spacing on the last 10 NM of the final approach is approximately 1 NM. It is shown that there are considerable differences per airport, and this illustrates that it is important to take into account local conditions in the assessment of benefits for a certain airport. Furthermore, the observed mean and variation of spacing buffers may suggest that for optimized runway throughput, new concepts should not only focus on reduction of minima but also on the management of distance spacing compression variation, e.g. better understanding and predicting aircraft speed performance, such that buffers can be optimized."
46,470,The Effectiveness of a Route Crossing Tool in a Simulated New York Airspace,"Bonny Parke ,     Eric  Chevalley,  Nancy Bienert,  Paul Lee,  Kari Gonter,  Faisal Omar,  Joshua Kraut,  Hyo-Sang Yoo,  Abhay Borade,  Conrad Gabriel,  Daphne Rein-Weston,  Everett Palmer",/seminarContent/seminar11/papers/470_Parke_0126150330-Final-Paper-5-4-15.pdf,/seminarContent/seminar11/presentations/470-Parke_0126150330-PresentationPDF-7-5-15.pdf,,Separation,"Congested airspace is the cause of many delays in the terminal area and these delays can have a ripple effect on the rest of a nation's airspace. The New York terminal area is an example of where this happens in the U. S.   An important goal, therefore, is to increase the efficiency of operations in congested terminal airspace where possible. Modeling studies of arrival and departure flows have shown that sharing of arrival and departure airspace increases efficiency in terminal operations.  One source of inefficiency in terminal operations is that departure aircraft are frequently held level under arrival flows when it would be more efficient to climb the departure aircraft earlier. A Route Crossing Tool was developed to help controllers climb Newark (EWR) departures to the south earlier by temporarily sharing airspace with arrivals coming into LaGuardia (LGA) from the south. Instead of flying under the arrivals, a departure to the south could climb earlier by flying through the arrival airspace if there was a suitable gap between arrivals.  A Human-in-the-Loop (HITL) simulation was conducted in this environment which compared three tool conditions:  Baseline (no tool), a Single Route Crossing tool in which one route through the arrival flow was evaluated for crossing, and a Multi-Route Crossing tool in which five parallel routes were evaluated. In all conditions, the departures could be held level under the arrival flow.  The results showed that controllers climbed a higher proportion of departures in the Multi-Route tool condition than in the other two conditions, with a higher proportion of departures climbed in smaller gaps and in front of trailing arrivals.  The controllers indicated that the Multi-Route and Single Route tools helped them estimate distances more accurately and rated safety, workload, and coordination in the simulation as acceptable."
47,471,Exploring Wind Information Requirements for Four Dimensional Trajectory-Based Operations,"Tom Reynolds ,     Michael McPartland,  Thomas Teller,  Seth Troxel",/seminarContent/seminar11/papers/471-Reynolds_0126150332-Final-Paper-6-12-15.pdf,/seminarContent/seminar11/presentations/471-Reynolds_0126150332-PresentationPDF-6-12-15.pdf,,Weather in ATM,"Many future air traffic control concepts depend on access to high accuracy wind data due to time-based control elements, such as required time of arrival at a meter fix under 4D-Trajectory-Based Operations. Errors in the wind information relative to the truth winds could significantly degrade the performance of the procedure. Unacceptable performance could be mitigated by improving wind information accuracy by using higher accuracy forecast models, updating wind information more frequently, or upgrading the way winds are handled in the avionics systems. This paper: (1) establishes the relationship of wind information accuracy to 4D-TBO performance for a selection of operationally relevant scenarios to identify wind needs to support them, and (2) presents examples of how this information can be used to determine what wind information content and update rate to the aircraft will deliver a given target performance level to help inform concept of operations development and supporting technology needs."
48,472,A Flexible Framework for Solving the Air Conflict Detection and Resolution Problem using Maximum Cliques in a Graph,"Thibault Lehouillier ,     Jeremy Omer,  François Soumis,  Guy Desaulniers",/seminarContent/seminar11/papers/472_Lehouillier_0126150332-Final-Paper-4-30-15.pdf,/seminarContent/seminar11/presentations/472-Lehouillier_0126150332-PresentationPDF-6-9-15.pdf,,Separation,"In this article, we present a new formulation for the air conflict detection and resolution problem. Given the current position, speed and acceleration of a set of aircraft, we identify the maneuvers required to avoid all possible conflicts and such that the fuel costs are minimized. To this end, we design a graph whose vertices correspond to discretized values of maneuvers and whose edges link conflict-free maneuvers. Finding a solution to the problem is equivalent to searching a clique of minimum weight and maximum cardinality in the graph. We formulate this search as a mixed integer linear program, since the weights of the vertices depend on the vertices in the clique. The significance of the presented algorithm relies on its flexibility, as changing hypotheses like the objective function, aircraft dynamics or the maneuvers considered do not change the method presented. Computational results highlight short solution times, where situations involving up to 20 aircraft in a complex situation are solved to optimality in less than 20 seconds."
49,473,Autonomous Air Traffic Control for Non-Towered Airports,"Zouhair Mahboubi ,     Mykel Kochenderfer",/seminarContent/seminar11/papers/473_Mahboubi_0126150352-Final-Paper-5-4-15.pdf,/seminarContent/seminar11/presentations/473-Mahboubi_0126150352-PresentationPDF-6-1-15.pdf,,Separation,"Half of all reported near mid-air collisions involve at least one general aviation aircraft. More than half of NTSB reports of mid-air collisions occur in the vicinity or in the traffic pattern of an airport, and a majority of them occur at non-towered airports. This paper proposes a concept for traffic collision prevention targeted for general aviation aircraft operating in the vicinity of non-towered airports. We envision an autonomous air traffic control system as a non-intrusive, ground based system with no additional requirements to participating aircraft except for radio communication. We outline how such a system can be modeled and solved as a Markov decision process and present simulation results for aircraft in the traffic pattern."
50,477,Modelling Delay Propagation Trees for Scheduled Flights,"Carla Ciruelos ,     Andres Arranz,  Izaro Etxebarria,  Sara Peces,  Bruno Campanelli,  Pablo Fleurquin,  Victor M. Eguiluz,  Jose Javier Ramasco",/seminarContent/seminar11/papers/477_Ciruelos_0126150405-Final-Paper-5-6-15.pdf,/seminarContent/seminar11/presentations/477_Ciruelos_0126150405-PresentationPDF-6-15-15.pdf,,"Complexity science, analytics and big data for ATM","Reactionary delays have a large impact in the air transportation system both at operational and economical point of view. However, research efforts to understand their origin and propagation patterns in Europe have been limited. The TREE project (data-driven modeling of network-wide extension of the tree of reactionary delays in ECAC area) is focused on characterizing and forecasting the propagation of reactionary delays through the European Network. The best approach to tackle this problem passes through the use of Complex Systems theory. This theory analyzes systems formed by a large number of components interacting between them by means of networks and attempts at predicting their meso-scale and global behaviors. In this project the nodes are the airports and the links are created by direct flights, the delays appear as malfunctions in the schedule planned everyday that can and do propagate to an important fraction of the airports in the network. In this work, an agent-based approach is introduced, able to simulate the delay propagation process. The first results show a promising similarity with the real delay propagation patterns, being able to describe the cluster of congested airports and its evolution along the day."
51,479,"Air Transportation and Multimodal, Collaborative Decision Making during Adverse Events","aude Marzuoli ,     Antony Evans,  Isabelle Laplace,  Eric  Feron,  Lynnette Dray",/seminarContent/seminar11/papers/479_Marzuoli_0126150409-Final-Paper-4-30-15.pdf,/seminarContent/seminar11/presentations/479_Marzuoli_0126150409-PresentationPDF-6-16-15.pdf,,Globally interoperable systems and data,"This paper makes the case for multimodal Collaborative Decision Making (CDM) during adverse events.  Two case studies, the Asiana Crash in the US, and an hypothetical closure of London Heathrow airport  in Europe, demonstrate that multimodal alternatives to reaccommodate passengers impacted by diversions  and cancellations, have the potential to significantly decrease passenger delay at effective costs.  Based upon additional evidence and interviews conducted a preliminary study sponsored by the EU, a  multimodal CDM concept is elaborated, defining milestones and information flows to support harmonized  decision-making  and passenger treatment, and ensure a faster recovery process from a passenger  standpoint."
52,481,Cruise Fuel Reduction Potential from Altitude and Speed Optimization in Global Airline Operations,"Luke Jensen ,     R. John Hansman,  Henry Tran",/seminarContent/seminar11/papers/481-Jensen_0126150437-Final-Paper-5-7-15.pdf,/seminarContent/seminar11/presentations/481-Jensen_0126150437-PresentationPDF-6-10-15.pdf,,Environment and energy efficiency,"This paper examines the potential fuel efficiency benefits of cruise altitude and speed optimization using historical fight path records. Results are presented for a subset of domestic US flights in 2012 as well as for long haul flights tracked by the European IAGOS atmospheric research program between 2010 and 2013. For a given lateral flight route, there exists an optimal combination of altitude and speed. Analysis of 217,000 flights domestic US airspace has shown average potential savings of up to 1.96% for altitude optimization or 1.93% for speed optimization. International flights may be subject to different airline and/or air traffic management procedures and constraints. Examination of 3,478 long-haul flights, representing three airlines and a single aircraft type over a four-year period, indicates average potential savings of up to 0.87% for altitude optimization or 1.81% for speed optimization. This is equivalent to a mean fuel savings of 905 pounds and 1981 pounds per flight, respectively. Due to the limited sample set for long haul flight records, conclusions from this stage of the international study are currently limited to the specific airlines and aircraft types included in the IAGOS measurement program."
53,483,Conflict pattern analysis under the consideration of optimal trajectories in the European ATM,"Manuerl Soler ,     Sergio Ruiz",/seminarContent/seminar11/papers/483-Soler_0126150504-Final-Paper-5-8-15.pdf,/seminarContent/seminar11/presentations/483-Soler_0126150504-PresentationPDF-6-25-15.pdf,,Trajectory and queue management,"In the future Air Traffic Management (ATM) sys- tem, the trajectory becomes the fundamental element of a new set of operating procedures collectively referred to as Trajectory-Based Operations (TBO). This has encouraged a renewed interest for the application of trajectory optimization techniques in commercial aviation, resulting in the so-called continuous operations that have shown significant benefits in terms of fuel savings and CO2 emissions. Unfortunately, the real implementation of continuous operations is in turn still far to be possible. Its implementation must be also tested and compared against other key performance areas such as safety and capacity. Therefore, the main contribution of this paper is to provide a preliminary analysis on how continuous operations might impact the traffic patterns at the European ATM network level. Based on simulations using realistic traffic scenarios and realistic flight performances, this paper provides insight on the conflict patterns (as an indicator of ATM safety and capacity) under the consideration of continuous operations in the European ATM. The problem analysis has two scales, i.e., the mircroscale and the mesoscale. The microscale refers to single trajectories, whereas the mesoscale refers to a number of trajectories that may interact among them within a given volume of airspace (in this case, a big single sector representing the entire European airspace)."
54,487,European route choice determinants,Luiss Delgado,/seminarContent/seminar11/papers/487_Delgado_0126150532-Final-Paper-4-30-15.pdf,/seminarContent/seminar11/presentations/487-Delgado_0126150532-PresentationPDF-6-29-15.pdf,,Finance and policy,"Different charging zones are found within European airspace. This allows airlines to select different  routes between origin and destination that have different lengths and en-route charges. There is a trade- off between the shortest available route and other routes that might have different charges. This paper  analyses the routes submitted by airlines to be operated on a given day and compares the associated costs  of operating those routes with the shortest available at the time, in terms of en-route charges and fuel  consumption. The flights are characterised by different variables with the idea of identifying a behaviour  or pattern based on the airline or flight characteristics. Results show that in some areas of the European  airspace there might be an incentive to select a longer route, leading to both a lower charge and a lower  total cost. However, more variables need to be considered and other techniques used, such as factor  analysis, to be able to identify the behaviour within an airline category."
55,498,Metropolis: Relating Airspace Structure and Capacity for Extreme Traffic Densities,"Emmanuel Sunil ,     Stefan  Kern,  Dennis Nieuwenhuisen,  Andrija  Vidosavljevic,  Jacco Hoekstra,  Joost Ellerbroek,  Frank Bussink",/seminarContent/seminar11/papers/498_Sunil_0126150624-Final-Paper-4-30-15.pdf,/seminarContent/seminar11/presentations/498-Sunil_0126150624-PresentationPDF-6-2-15.pdf,,Unmanned and remotely piloted aircraft systems,"Personal and unmanned aerial vehicles have received increasing media attention over the last decade.  As a result of the growing excitement for these two aircraft types, many within and outside the  aerospace industry envision a future in which large numbers of small aircraft fly over urban areas.  With this vision for the future, the question arises what would be required, in terms of airspace  organization, to make this feasible, or indeed, if it will be possible at all. In this context, the  Metropolis project aims to investigate the influence of airspace structure on capacity, complexity,  safety, and efficiency for high-density airspace. To this end, four airspace concepts, ranging from a  decentralized direct routing concept, to a highly structured tube network using 4D trajectory-based  operations, have been considered. The four concepts were compared by means of large-scale simulation  experiments, for multiple scenarios that are extreme when compared to current air traffic densities.  This paper presents an overview of the Metropolis project with a focus on the project objectives,  design and implementation of airspace concepts, and preliminary simulation results."
56,501,Investigating Benefits from Continuous Climb Operating Concepts in the National Airspace System,"Dominic McConnachie ,     Philippe Bonnefoy,  Akshay Belle",/seminarContent/seminar11/papers/501-McConnachie_0126150628-Final-Paper-5-7-15.pdf,/seminarContent/seminar11/presentations/501-McConnachie_0126150628-PresentationPDF-6-29-15.pdf,,Environment and energy efficiency,"Operational improvements have the potential for near term environmental and energy benefits in the National Airspace System. Research into terminal area operational improvements has predominantly investigated the descent phase of flight (i.e., Continuous Descent Approaches [CDAs], Optimized Profile Descents [OPDs]). This paper investigates the climb phase of flight and investigates the need for continuous climb operations. The paper presents the results of an analysis which quantifies the prevalence of departure inefficiencies in the National Airspace System and the magnitude of operational and environmental performance change if continuous climb operations are implemented at certain airports. Results show that climb inefficiencies occur on average for 30% of departures in the National Airspace System. A detailed operational and energy analysis at Boston Logan International Airport shows that the average potential fuel savings from continuous climb operations are 12kg per departure and the annual carbon dioxide savings are 3,127 tons. The distribution in fuel savings is skewed, with a few operations having greater than average fuel savings. Implementing continuous climb operations for 18% of operations could result in the capture of 59% of total fuel savings from continuous climb operations. Change in noise impact is minimal but limited by the chosen metric and alternative metrics may quantify noise impact reductions. There are two concentrations of level-offs at flight level 140 and flight level 220 providing evidence of the role of airspace design and constraints in climb inefficiencies."
57,509,Predicting Airport Runway Configuration: A Discrete-Choice Modeling Approach,"Hamsa Balakrishnan ,     Jacob Avery",/seminarContent/seminar11/papers/509-Balakrishnan_0126150652-Final-Paper-6-23-15.pdf,/seminarContent/seminar11/presentations/509-Balakrishnan_0126150652-PresentationPDF-6-29-15.pdf,,ATM performance measurement and management,"The runway configuration is a key driver of airport capacity at any time. Several factors, such as weather conditions (wind and visibility), traffic demand, air traffic controller workload, and the coordination of flows with neighboring airports influence the selection of runway configuration.   This paper identifies a discrete-choice model of the configuration selection process from empirical data. The model reflects the importance of various factors in terms of a utility function. Given the weather, traffic demand and the current runway configuration, the model provides a probabilistic forecast of the runway configuration at the next 15-minute interval. This prediction is then extended to obtain the 3-hour probabilistic forecast of runway configuration. The proposed approach is illustrated using case studies based on data from LaGuardia (LGA) and San Francisco (SFO) airports, first by assuming perfect knowledge of weather and demand 3-hours in advance, and then using the Terminal Aerodrome Forecasts (TAFs). The results show that given the actual traffic demand and weather conditions 3 hours in advance, the model predicts the correct runway configuration at LGA with an accuracy of 82%, and at SFO with an accuracy of 81%. Given the forecast weather and scheduled demand, the accuracy of correct prediction of the runway configuration 3 hours in advance is 79% for LGA and 80% for SFO."
58,511,"Delay propagation – new metrics, new insights","Andrew Cook ,     Graham Tanner,  Samuel Cristóbal,  Massimiliano Zanin",/seminarContent/seminar11/papers/511_Cook_0126150652-Final-Paper-4-27-15.pdf,/seminarContent/seminar11/presentations/511_Cook_0126150652-PresentationPDF-6-15-15.pdf,,Finance and policy,"Network delay propagation is intimately linked with the challenges of managing passenger itineraries and corresponding connections. Airline decision-making governing these processes is driven by operational and regulatory factors. Using the first European network simulation model with explicit passenger itineraries and full delay cost estimations, we explore these factors through various flight and passenger prioritisation rules, assessing the performance impacts. Delay propagation is further characterised under the different prioritisation rules using complexity science techniques such as percolation theory and network attack. The relative effects of randomised and targeted disruption are compared."
59,512,Combining Control by CTA and Dynamic Enroute Speed Adjustment to Improve Ground Delay Program Performance,"Dave Lovell ,     James Jones,  Michael Ball",/seminarContent/seminar11/papers/512_Lovell_0126150655-Final-Paper-5-12-15.pdf,/seminarContent/seminar11/presentations/512-Lovell_0126150655-PresentationPDF-6-21-15.pdf,,Network and strategic flow optimisation,"Over the past several years there have been proposals and discussions regarding a move from the use of controlled times of departure (CTDs) to controlled times of arrival (CTAs) for ground delay programs (GDPs) in the U.S. In this paper we show that, by combining control by CTA with the judicious use of en route speed control, significant improvements to GDP performance can be achieved. Our analysis of this problem includes both new GDP control procedures and also new flight operator GDP planning models. While the ability to achieve all the benefits we describe will require NextGen capabilities, substantial performance improvements could be obtained even with a near-term implementation."
